site_no,station_nm,dec_long_va,dec_lat_va,drain_area_va,flood_stage,flood_nu,moderate_flood_stage,moderate_flood_nu,major_flood_stage,major_flood_nu,flow_dt,flow_va,stage_dt,stage_va,peak_rank,peak_count,peak_max,peak_max_yr
"08019200","Sabine Rv nr Hawkins, TX",-95.20661400,32.55986369,2259,23,7,32,0,37,0,2019-05-20,10300,2019-05-20,27.93,13,20,42500,2015
"08020000","Sabine Rv nr Gladewater, TX",-94.96021750,32.52708909,2791,26,8,33,3,36,0,2019-05-20,14100,2019-05-20,34.48,44,88,138000,1945
"08020900","Sabine Rv bl Longview, TX",-94.70993240,32.41681793,3155,25,8,30,5,35,0,2019-05-20,21400,2019-05-20,33.62,5,22,40100,2016
"08022040","Sabine Rv nr Beckville, TX",-94.35353020,32.32737887,3589,26,8,30,1,35,0,2019-05-20,26200,2019-05-20,30.12,19,79,123000,1945
"08022500","Sabine Rv at Logansport, LA",-94.00630140,31.97238949,4842,28,8,32,0,34,0,2019-05-21,32600,2019-05-21,31.43,17,87,92000,1945
"08028000","Bayou Anacoco near Rosepine, LA",-93.35294380,30.95297038,365.00,17,3,21,0,24,0,2019-05-20,5450,2019-05-20,20.31,41,66,64300,1953
"08028500","Sabine Rv nr Bon Wier, TX",-93.60850800,30.74714557,8229,30,8,33,8,36,0,2019-05-20,50100,2019-05-20,35.44,21,95,279000,2016
"08029500","Big Cow Ck nr Newton, TX",-93.78555560,30.81888889,128,15,2,16,1,18,0,2019-05-20,5650,2019-05-20,17.17,24,67,41500,2006
"08030500","Sabine Rv nr Ruliff, TX",-93.74377840,30.30381684,9329,24,8,26,5,28,0,2019-05-23,53500,2019-05-23,26.38,28,106,206000,2016
"08030540","Sabine Rv (at Navy Pier) at Orange, TX",-93.72155440,30.09798774,-999,4,1,5,0,6,0,-999,-999,2019-05-22,4.01,-999,-999,-999,-999
"08032000","Neches Rv nr Neches, TX",-95.43078600,31.89239037,1145,12,8,18,0,24,0,2019-05-20,4660,2019-05-20,15.45,48,79,45500,1945
"08032500","Neches Rv nr Alto, TX",-95.16599650,31.57945569,1945,16,8,18,5,20,3,2019-05-20,21200,2019-05-20,22.03,8,37,50000,1884
"08033000","Neches Rv nr Diboll, TX",-94.80993060,31.13296574,2724,12,8,17,0,20,0,2019-05-24,17000,2019-05-24,15.71,27,81,110000,1884
"08033900","E Fk Angelina Rv nr Cushing, TX",-94.82326970,31.86017169,158,15,2,17,0,19,0,2019-05-20,2930,2019-05-20,16.19,19,28,19800,1988
"08036500","Angelina Rv nr Alto, TX",-94.95271520,31.67184364,1276,29,2,31,0,33,0,2019-05-21,12000,2019-05-21,29.16,17,62,42500,1989
"08038000","Attoyac Bayou nr Chireno, TX",-94.30436770,31.50434957,503,14,8,22,0,26,0,2019-05-21,8700,2019-05-21,19.65,36,82,50000,1902
"08039100","Ayish Bayou nr San Augustine, TX",-94.15102890,31.39629597,89.0,12,1,16,0,17,0,2019-05-20,1820,2019-05-20,12.75,48,60,42100,2008
"08040600","Neches Rv nr Town Bluff, TX",-94.15102370,30.79103579,7574,68,4,72,0,82.5,0,2019-05-20,21600,2019-05-20,69.00,30,68,120000,1884
"08041700","Pine Island Bayou nr Sour Lake, TX",-94.33463240,30.10604640,336,25,1,29,0,32,0,2019-05-20,1810,2019-05-20,25.16,46,50,50500,2017
"08041780","Neches Rv Saltwater Barrier at Beaumont, TX",-94.11434690,30.15687800,9789,4,7,6,0,8,0,2019-05-20,25700,2019-05-20,5.13,10,13,232000,2017
"08044500","W Fk Trinity Rv nr Boyd, TX",-97.55863600,33.08539917,1725,16,5,20,0,24,0,2019-05-21,4240,2019-05-21,17.59,31,70,60400,1981
"08053500","Denton Ck nr Justin, TX",-97.29057320,33.11901003,400,10,1,15,0,17,0,2019-05-20,1990,2019-05-20,10.71,50,68,34700,1981
"08055500","Elm Fk Trinity Rv nr Carrollton, TX",-96.94445000,32.96595700,2459,8,4,10,0,12,0,2019-05-27,7050,2019-05-27,8.40,57,95,145000,1908
"08057000","Trinity Rv at Dallas, TX",-96.82194640,32.77485170,6106,30,5,38,0,40,0,2019-05-20,22400,2019-05-20,36.15,59,114,184000,1908
"08062500","Trinity Rv nr Rosser, TX",-96.46304150,32.42652988,8147,31,1,36,0,38,0,2019-05-21,28400,2019-05-21,31.12,40,81,150000,1942
"08062700","Trinity Rv at Trinidad, TX",-96.10247080,32.14765255,8538,33,8,40,0,46,0,2019-05-24,24000,2019-05-24,39.07,38,53,94500,1990
"08065000","Trinity Rv nr Oakwood, TX",-95.78940290,31.64850597,12833,35,8,40,5,45,0,2019-05-20,47400,2019-05-20,44.34,40,96,180000,1890
"08065350","Trinity Rv nr Crockett, TX",-95.65634070,31.33851319,13911,41,6,45,3,48,0,2019-05-20,59800,2019-05-20,45.88,11,55,109000,1990
"08066000","Trinity Rv at Riverside, TX",-95.39883000,30.85935514,15589,133.5,8,136,8,140,0,-999,-999,2019-05-25,136.83,-999,-999,-999,-999
"08067000","Trinity Rv at Liberty, TX",-94.81825670,30.05771539,17468,26,8,27,8,29,1,2019-05-20,52400,2019-05-20,29.14,29,77,135000,1994
"08067100","Trinity Rv nr Moss Bluff, TX",-94.77436600,29.94188470,17573,12.2,8,15.2,0,17.2,0,-999,-999,2019-05-20,14.48,-999,-999,-999,-999
"08068500","Spring Ck nr Spring, TX",-95.43632750,30.11049517,409,-999,-999,-999,-999,-999,-999,2019-05-20,382,2019-05-20,75.21,80,80,78800,1994
"08069500","W Fk San Jacinto Rv nr Humble, TX",-95.25798880,30.02716385,1741,-999,-999,-999,-999,-999,-999,2019-05-21,2430,2019-05-20,42.69,-9,26,187000,1940
"08110500","Navasota Rv nr Easterly, TX",-96.29774300,31.17018205,968,19,3,23,2,26,0,2019-05-20,21600,2019-05-20,24.31,36,94,90000,1899
"08110800","Navasota Rv at Old San Antonio Rd nr Bryan, TX",-96.24162740,30.97379870,1287,15,3,18,0,20,0,2019-05-21,9440,2019-05-21,16.70,17,21,54300,2009
"08170950","Blanco Rv at Fischer Store Rd nr Fischer, TX",-98.20036110,30.00058333,-999,17,8,23,0,38,0,2019-05-20,354,2019-05-24,21.65,-999,-999,-999,-999
"08177520","Guadalupe Rv nr Bloomington, TX",-96.96527780,28.66194444,5816,20,2,24,0,27,0,2019-05-20,3740,2019-05-20,20.38,-999,-999,-999,-999
"411925089063901","ILLINOIS RIVER NEAR LA SALLE, IL (CORPS)",-89.11091680,41.32364590,12572,20,8,27,0,31,0,-999,-999,2019-05-24,25.26,-999,-999,-999,-999
