site_no,station_nm,dec_long_va,dec_lat_va,drain_area_va,flood_stage,flood_nu,moderate_flood_stage,moderate_flood_nu,major_flood_stage,major_flood_nu,flow_dt,flow_va,stage_dt,stage_va,peak_rank,peak_count,peak_max,peak_max_yr
"06918740","Little Sac River near Morrisville, MO",-93.48563890,37.48286110,237,14,4,17,4,25,0,2019-05-23,23700,2019-05-23,22.31,4,49,33700,2007
"06919500","Cedar Creek near Pleasant View, MO",-93.87549180,37.83420277,420,21,5,23,4,28,0,2019-05-24,23500,2019-05-24,25.26,9,75,37000,1958
"06919900","Sac River near Caplinger Mills, MO",-93.80316670,37.86983330,1810,16,7,19,7,28,0,2019-05-22,28800,2019-05-22,27.57,8,43,61500,1994
"06920520","Weaubleau Creek near Weaubleau, MO",-93.51476110,37.89549167,37.8,8,1,15,0,-999,-999,2019-05-21,3980,2019-05-21,9.87,6,6,14600,2015
"06921070","Pomme de Terre River near Polk, MO",-93.37033330,37.68266667,276,17,4,21,0,27,0,2019-05-21,16500,2019-05-21,19.64,17,49,38200,2015
"06921200","Lindley Creek near Polk, MO",-93.26619440,37.75047220,112,17,2,-999,-999,-999,-999,2019-05-21,15600,2019-05-21,19.74,12,62,38460,1914
"06921600","South Grand River at Urich, MO",-94.00438590,38.45223976,670,24,6,26,5,33,0,2019-05-22,23300,2019-05-22,29.36,3,13,29200,1961
"06921720","Big Creek near Blairstown, MO",-93.96535280,38.55497778,414,20,8,23,6,36,0,2019-05-22,13200,2019-05-22,26.24,6,35,24400,1961
"06923250","Niangua River at Windyville, MO",-92.92434950,37.68420670,377,12,4,20,0,-999,-999,2019-05-24,14700,2019-05-24,15.77,9,16,58800,2015
"06923500","Bennett Spring at Bennett Springs, MO",-92.85757220,37.71714720,100,5,1,-999,-999,-999,-999,2019-05-23,1720,2019-05-23,5.08,26,54,12600,1990
"06923940","Niangua River ab Lake Niangua nr Macks Creek, MO",-92.89805560,37.86333330,522,15,3,-999,-999,-999,-999,2019-05-22,17600,2019-05-22,16.21,6,9,49500,2015
"06923950","Niangua River at Tunnel Dam near Macks Creek, MO",-92.85136110,37.93694444,598,11,4,-999,-999,-999,-999,2019-05-23,16000,2019-05-23,13.63,8,22,59200,2015
"06928000","Gasconade River near Hazelgreen, MO",-92.45183830,37.75920725,1250,21,1,26,0,30,0,2019-05-22,35700,2019-05-22,22.48,28,73,119000,2017
"06928300","Roubidoux Creek above Fort Leonard Wood, MO",-92.23380560,37.60108330,165,11,1,14,1,18,0,2019-05-21,14600,2019-05-21,16.41,6,17,31800,2008
"06928420","Roubidoux Creek at Polla Rd bl Ft. Leonard Wood",-92.18333330,37.79194444,273,7,2,14,0,20,0,2019-05-21,10500,2019-05-21,10.01,7,9,38600,2013
"06930000","Big Piney River near Big Piney, MO",-92.04991670,37.66563889,560,8.5,3,-999,-999,-999,-999,2019-05-22,14300,2019-05-22,14.96,42,88,90200,2017
"06930060","Big Piney below Fort Leonard Wood, MO",-92.05797220,37.76025000,593,8,3,15,0,23,0,2019-05-22,14700,2019-05-22,13.98,11,17,93500,2017
"06933500","Gasconade River at Jerome, MO",-91.97733330,37.92991667,2840,15,3,25,0,30,0,2019-05-24,38700,2019-05-24,17.60,41,99,197000,2017
"06934500","Missouri River at Hermann, MO",-91.43850000,38.70980556,522500,21,8,26,7,33,0,2019-05-26,409000,2019-05-26,32.53,18,90,750000,1993
"06935450","Missouri River at Washington, MO",-91.00750000,38.55972220,523200,20,7,28,3,31,0,2019-05-26,428000,2019-05-26,28.68,3,8,520000,2017
"06935965","Missouri River at St. Charles, MO",-90.47072220,38.78886110,524000,25,8,30,5,36,0,2019-05-27,400000,2019-05-27,33.91,4,17,515000,2017
"07010000","Mississippi River at St. Louis, MO",-90.17977780,38.62900000,697000,30,8,35,8,40,4,2019-05-27,825000,2019-05-27,42.12,13,157,1080000,1993
"07014500","Meramec River near Sullivan, MO",-91.10847220,38.15852778,1475,11,1,20,0,29,0,2019-05-22,10500,2019-05-22,11.08,75,87,95300,2017
"07018500","Big River at Byrnesville, MO",-90.63780560,38.39172220,917,16,1,20,0,28,0,2019-05-23,9810,2019-05-23,16.62,81,96,80000,1915
"07019130","Meramec River at Valley Park, MO",-90.48502780,38.54661110,3850,16,5,19,4,25,0,-999,-999,2019-05-27,20.23,-999,-999,-999,-999
"07019210","Meramec River at Fenton, MO",-90.43138890,38.51222220,3880,25,5,29,0,32,0,-999,-999,2019-05-27,28.65,-999,-999,-999,-999
"07019300","Meramec River at Arnold, MO",-90.36067350,38.45672030,3950,24,8,35,5,38,1,-999,-999,2019-05-27,38.31,-999,-999,-999,-999
"07020500","Mississippi River at Chester, IL",-89.83021110,37.90074167,708600,27,8,35,8,40,4,2019-05-27,855000,2019-05-27,43.24,11,93,1060000,1927
"07020850","Mississippi River at Cape Girardeau, MO",-89.51800000,37.30188889,-999,32,8,37,8,42,2,-999,-999,2019-05-27,43.25,-999,-999,-999,-999
"07022000","Mississippi River at Thebes, IL",-89.46297500,37.22160000,713200,33,8,37,8,42,0,2019-05-27,773000,2019-05-27,41.06,16,86,1075000,1844
"07050690","Pearson Creek near Springfield, MO",-93.19838890,37.17794444,21.0,6,1,9,1,11,0,2019-05-21,3480,2019-05-21,9.66,1,18,2980,2008
"07050700","James River near Springfield, MO",-93.20338890,37.14997220,246,12,2,15,2,20,0,2019-05-21,10300,2019-05-21,15.58,43,63,62000,1909
"07052100","Wilson Creek near Springfield, MO",-93.37027780,37.16852778,31.4,7,2,12,0,-999,-999,2019-05-23,4100,2019-05-23,9.09,7,29,6710,2015
"07052120","South Creek near Springfield, MO",-93.36277780,37.15363889,10.5,5,1,8.6,0,-999,-999,2019-05-21,1670,2019-05-21,6.05,4,18,2870,2000
"07052152","Wilson Creek near Brookline, MO",-93.37547220,37.14713889,51,10,2,-999,-999,-999,-999,2019-05-23,3300,2019-05-23,10.43,8,16,9530,2008
"07052160","Wilson Creek near Battlefield, MO",-93.40386110,37.11775000,58.3,7,3,17,0,-999,-999,2019-05-23,4600,2019-05-23,10.78,5,17,7240,1979
"07052500","James River at Galena, MO",-93.46158330,36.80538889,987,15,2,25,0,31,0,2019-05-22,25600,2019-05-22,17.78,41,96,85100,2008
"07052820","Flat Creek below Jenkins, MO",-93.61852640,36.75061750,274,7,3,12,2,-999,-999,2019-05-21,8320,2019-05-21,13.35,7,11,35500,2017
"07061500","Black River near Annapolis, MO",-90.78875000,37.33813889,484,8,2,15,0,25,0,2019-05-22,11300,2019-05-22,11.41,62,79,109000,1993
"07066510","Current River above Powder Mill, MO",-91.17766390,37.18561389,1340,8,3,25,0,40,0,-999,-999,2019-05-22,10.70,-999,-999,-999,-999
"07069000","Black River at Pocahontas, AR",-90.97027780,36.25416667,4840,17,6,22,0,25,0,2019-05-27,17500,2019-05-27,19.44,51,83,105000,2017
"07072500","Black River at Black Rock, AR",-91.09777780,36.10250000,7370,14,8,25,0,28,0,2019-05-23,25900,2019-05-23,20.81,92,113,190000,1982
"07074850","White River near Augusta, AR",-91.39416670,35.29444444,20500,26,8,34,0,36,0,2019-05-20,55700,2019-05-20,31.81,23,80,267000,2017
"07076750","White River at Georgetown, AR",-91.44972220,35.12888889,22400,21,7,24,0,28,0,2019-05-20,56600,2019-05-20,22.10,27,103,179000,1982
"07141200","PAWNEE R AT ROZEL, KS",-99.40622470,38.20751450,2148,31,4,33,3,35,0,2019-05-25,5440,2019-05-25,34.53,14,93,16300,1958
"07141300","ARKANSAS R AT GREAT BEND, KS",-98.76425190,38.35306787,34356,12,3,16,0,18,0,2019-05-27,10200,2019-05-27,14.17,7,78,27800,1965
"07141900","WALNUT C AT ALBERT, KS",-99.01481700,38.46167948,1618,24,3,25,3,25.7,0,2019-05-27,2530,2019-05-26,25.11,12,60,12700,1959
"07143300","COW C NR LYONS, KS",-98.19200450,38.30834380,728,18,5,22,0,24.7,0,2019-05-21,5240,2019-05-21,18.57,13,73,28000,1929
"07143310","COW C NR HUTCHINSON, KS",-98.00783150,38.14417747,859.5,9.5,8,10.5,8,12.5,0,-999,-999,2019-05-22,12.00,-999,-999,-999,-999
"07143330","ARKANSAS R NR HUTCHINSON, KS",-97.77504880,37.94640028,38910,10,7,11,7,12,3,2019-05-22,16500,2019-05-22,12.81,5,58,24700,1973
"07143665","L ARKANSAS R AT ALTA MILLS, KS",-97.59198700,38.11223260,736,22,6,25,2,27,0,2019-05-22,9790,2019-05-22,25.63,10,45,30100,1973
"07143672","L ARKANSAS R AT HWY 50 NR HALSTEAD, KS",-97.54059700,38.02862230,759,25,6,27,2,29,0,2019-05-22,9800,2019-05-22,27.09,3,22,11000,2007
"07144050","EMMA C AT SEDGWICK, KS",-97.44545560,37.98512778,-999,19,2,-999,-999,-999,-999,2019-05-21,7610,2019-05-21,20.17,1,3,7308,2016
"07144100","L ARKANSAS R NR SEDGWICK, KS",-97.42448640,37.88306739,1239,22,7,25,2,26,0,2019-05-22,19400,2019-05-22,25.82,1,24,17600,1998
"07144480","COWSKIN C AT 119TH ST AT WICHITA, KS",-97.48087970,37.70167994,86,18,3,22,0,24,0,2019-05-21,3010,2019-05-21,19.56,7,17,5870,2009
"07144550","ARKANSAS R AT DERBY, KS",-97.27559990,37.54418457,40830,12,7,15,3,16.2,0,2019-05-22,40300,2019-05-24,15.53,7,49,58300,1998
"07144570","ARKANSAS R AT MULVANE, KS",-97.26127220,37.47550278,40870.00,16.5,7,19,6,21,0,2019-05-25,40800,2019-05-25,20.28,1,3,28238,2016
"07145200","SF NINNESCAH R NR MURDOCK, KS",-97.85310940,37.56168300,597,8,6,10,2,12,0,2019-05-21,12000,2019-05-21,11.05,14,67,28700,1979
"07145500","NINNESCAH R NR PECK, KS",-97.42393530,37.45696360,2129,17,6,21,0,26,0,2019-05-22,23700,2019-05-22,19.92,13,81,70000,1923
"07145600","ARKANSAS R ON HWY 160 AT OXFORD, KS",-97.16226390,37.27440556,43801.00,17,7,20,6,23,0,2019-05-23,50200,2019-05-23,21.53,1,4,36449,2016
"07145700","SLATE C AT WELLINGTON, KS",-97.40365690,37.24946707,154,19,7,23,0,25,0,2019-05-21,6990,2019-05-21,22.90,15,58,28500,1975
"07146500","ARKANSAS R AT ARKANSAS CITY, KS",-97.03921940,37.03750830,43713,11,8,17,7,21,0,2019-05-27,61500,2019-05-27,20.33,10,100,103000,1923
"07146800","WB WALNUT R NR EL DORADO, KS",-96.84916670,37.82666667,62.00,21,2,22,0,24,0,2019-05-25,6950,2019-05-25,21.41,1,8,6469,2016
"07147190","WHITEWATER R AT AUGUSTA, KS",-96.99638890,37.67972220,456.00,21,7,25,4,30,0,-999,-999,2019-05-25,27.83,-999,-999,-999,-999
"07147800","WALNUT R AT WINFIELD, KS",-96.99614750,37.22391557,1880,18,8,22,7,29,5,2019-05-22,56600,2019-05-22,35.38,10,99,105000,1944
"07147900","WALNUT R AT ARKANSAS CITY, KS",-97.02587090,37.05641826,1952,18,7,22,6,28,0,-999,-999,2019-05-22,26.08,-999,-999,-999,-999
"07148400","Salt Fork Arkansas River nr Alva, OK",-98.64813950,36.81503056,982,14.5,2,16.5,0,18,0,2019-05-26,12400,2019-05-26,15.49,10,54,27000,1941
"07149000","MEDICINE LODGE R NR KIOWA, KS",-98.47090920,37.03891547,903,10,4,12,0,13,0,2019-05-27,6840,2019-05-27,11.67,14,74,16000,1941
"07151000","Salt Fork Arkansas River at Tonkawa, OK",-97.30948870,36.67197920,4470,17,8,20,7,25,3,2019-05-22,51900,2019-05-22,26.63,3,85,97300,1973
"07151500","CHIKASKIA R NR CORBIN, KS",-97.60199450,37.12891225,794,10,7,19,0,28,0,2019-05-27,19700,2019-05-27,17.40,12,59,60000,1923
"07152000","Chikaskia River near Blackwell, OK",-97.27726500,36.81142110,1876,29,5,30,5,32,3,2019-05-21,49300,2019-05-21,34.35,13,83,100000,1923
"07152500","Arkansas River at Ralston, OK",-96.72836720,36.50421677,54208,16,8,18,7,21,6,2019-05-23,185000,2019-05-23,22.14,3,95,211000,1973
"07153000","Black Bear Creek at Pawnee, OK",-96.79947880,36.34366537,538,17,8,21,5,25,2,2019-05-21,19500,2019-05-21,26.18,2,75,30200,1959
"07157950","Cimarron River near Buffalo, OK",-99.31538700,36.85197484,12205,9,2,10,0,12,0,2019-05-27,6270,2019-05-27,9.23,12,51,26400,1973
"07158000","Cimarron River near Waynoka, OK",-98.87953660,36.51725644,13399,8,8,10,3,12,0,2019-05-26,19700,2019-05-26,11.32,23,82,94500,1957
"07159100","Cimarron River near Dover, OK",-97.91449940,35.95170756,15809,17,7,20,7,22,2,2019-05-22,46600,2019-05-22,22.16,8,44,123000,1986
"07159750","Cottonwood Creek near Seward, OK",-97.47809700,35.81366006,320,30,2,35,1,40,0,2019-05-21,27500,2019-05-21,37.26,4,25,43500,1995
"07160000","Cimarron River near Guthrie, OK",-97.42587460,35.92060230,17006,18,6,22,0,25,0,2019-05-21,62100,2019-05-21,21.79,10,75,158000,1957
"07160350","Skeleton Creek at Enid, OK",-97.80033320,36.37614490,70,11,2,13,2,15,1,2019-05-20,8250,2019-05-20,15.25,2,21,9860,2008
"07160500","Skeleton Creek near Lovell, OK",-97.58504710,36.06004045,412,35,6,38,5,41,4,2019-05-21,27200,2019-05-21,43.48,8,62,75200,1957
"07161450","Cimarron River near Ripley, OK",-96.91225040,35.98589270,18117,17,7,20,7,22,6,2019-05-26,99600,2019-05-22,26.60,3,30,141000,1993
"07164500","Arkansas River at Tulsa, OK",-96.00638660,36.14064807,74460,18,6,20,6,22,5,2019-05-27,266000,2019-05-27,22.90,2,113,307000,1986
"07164600","Joe Creek at 61st St at Tulsa, OK",-95.96055010,36.07565044,11.6,8,1,-999,-999,12,0,2019-05-20,8460,2019-05-20,8.59,6,29,11600,2000
"07165562","Haikey Creek at 101st St South at Tulsa, OK",-95.84887770,36.01704297,17.9,16,2,19,2,24.5,0,2019-05-21,5310,2019-05-21,22.77,6,30,7100,2000
"07165570","Arkansas River near Haskell, OK",-95.63777780,35.82277778,75293,19,6,21,6,23,4,2019-05-27,261000,2019-05-27,23.49,1,45,259000,1986
"07166500","VERDIGRIS R NR ALTOONA, KS",-95.67470300,37.52977640,1094,19,7,21,2,26,0,2019-05-26,29600,2019-05-26,21.79,12,79,71000,1951
"07169500","FALL R AT FREDONIA, KS",-95.83359240,37.50838374,827,17,6,27,5,36,0,2019-05-26,28700,2019-05-26,31.77,11,83,77800,2007
"07170500","VERDIGRIS R AT INDEPENDENCE, KS",-95.67775730,37.22368014,2892,30,8,47.6,0,53,0,2019-05-27,75900,2019-05-27,45.35,10,103,168823,2017
"07171000","Verdigris River near Lenapah, OK",-95.58608820,36.85119615,3584,30,7,32,7,36,3,2019-05-22,52900,2019-05-23,36.76,10,79,192000,2007
"07174400","Caney River above Coon Creek at Bartlesville, OK",-95.97220640,36.75564425,1369,13,7,15,5,19,0,2019-05-21,20500,2019-05-21,18.21,4,32,94500,1986
"07175500","Caney River near Ramona, OK",-95.84193060,36.50898160,1936,26,7,28,6,31,0,2019-05-23,50400,2019-05-23,29.59,2,79,85600,1986
"07176000","Verdigris River near Claremore, OK",-95.69972220,36.30750000,6451,36,5,40,4,44,2,2019-05-27,93100,2019-05-27,45.46,3,83,182000,1943
"07176500","Bird Creek at Avant, OK",-96.06027430,36.48508798,369,17,4,21,4,26,4,2019-05-21,37800,2019-05-21,36.52,1,72,32400,1959
"07177500","Bird Creek near Sperry, OK",-95.95416200,36.27842534,907,21,7,24,4,29,3,2019-05-22,45000,2019-05-22,31.55,6,79,90000,1959
"07178000","Bird Creek near Owasso, OK",-95.86721300,36.24870534,1017,18,7,20,6,24,5,2019-05-23,37900,2019-05-23,29.84,1,38,29200,1993
"07179730","NEOSHO R NR AMERICUS, KS",-96.25055330,38.46695699,622,26,2,27,0,40,0,2019-05-22,11900,2019-05-22,26.47,11,54,17400,1993
"07180400","COTTONWOOD R NR FLORENCE, KS",-96.87724360,38.23612850,754,22,2,27,0,32,0,2019-05-22,19400,2019-05-22,26.11,10,57,73700,1998
"07182250","COTTONWOOD R NR PLYMOUTH, KS",-96.35611200,38.39751390,1740,32,7,34,0,37,0,2019-05-22,29100,2019-05-22,33.91,6,55,92900,1998
"07182260","COTTONWOOD R AT EMPORIA, KS",-96.18141670,38.38511110,1833.00,20,7,24,7,32,0,2019-05-23,18200,2019-05-23,25.50,2,4,18672,2017
"07182390","NEOSHO R AT NEOSHO RAPIDS, KS",-96.00026870,38.36807120,2753,22,7,23,7,44,0,-999,-999,2019-05-22,26.34,-999,-999,-999,-999
"07182510","NEOSHO R AT BURLINGTON, KS",-95.73526400,38.19446678,3042,27,6,40,0,45,0,2019-05-26,36500,2019-05-26,32.73,1,57,26200,1961
"07183000","NEOSHO R NR IOLA, KS",-95.42775960,37.92225778,3723,15,8,21,2,27,0,2019-05-25,54800,2019-05-25,21.38,9,111,436000,1951
"07183300","NEOSHO R NR ERIE, KS",-95.26436110,37.54950000,4547.00,29,8,32,7,36,7,-999,-999,2019-05-27,38.92,-999,-999,-999,-999
"07183500","NEOSHO R NR PARSONS, KS",-95.10996870,37.34005866,4905,21,8,23,8,32,0,2019-05-27,64500,2019-05-27,29.33,7,96,410000,1951
"07184000","LIGHTNING C NR MCCUNE, KS",-95.03274280,37.28117110,197,12,8,17,2,21,0,2019-05-21,19600,2019-05-21,17.80,13,67,67500,1993
"07185000","Neosho River near Commerce, OK",-94.95745740,36.92868144,5926,15,8,18,7,24,5,2019-05-24,90900,2019-05-24,25.51,7,82,267000,1951
"07185765","Spring River at Carthage, MO",-94.32591670,37.18863889,425,10,4,14,3,20,0,2019-05-23,28500,2019-05-23,17.98,4,30,40600,2015
"07186000","Spring River near Waco, MO",-94.56641670,37.24561110,1164,19,6,30,0,33,0,2019-05-24,54400,2019-05-24,27.97,9,95,151000,1993
"07187000","Shoal Creek above Joplin, MO",-94.51655560,37.02316667,427,11.5,3,16,0,18,0,2019-05-23,15700,2019-05-23,15.62,20,94,62100,1943
"07187600","SPRING R NR BAXTER SPRINGS, KS",-94.72105950,37.02367570,2448,14,7,22,4,30,0,2019-05-23,98500,2019-05-23,27.35,3,8,145714,2015
"07188000","Spring River near Quapaw, OK",-94.74717110,36.93451148,2516,20,7,24,6,30,3,2019-05-23,108000,2019-05-23,33.82,5,79,230000,1993
"07188653","Big Sugar Creek near Powell, MO",-94.18222220,36.61586110,141,10,1,15,0,20,0,2019-05-21,4440,2019-05-21,10.70,12,17,30900,2013
"07188838","Little Sugar Creek near Pineville, MO",-94.37326930,36.58396200,195,6,3,-999,-999,-999,-999,2019-05-21,6540,2019-05-21,12.12,8,13,26500,2015
"07189000","Elk River near Tiff City, Mo",-94.58688860,36.63146127,851,15,2,20,0,25,0,2019-05-21,28600,2019-05-21,18.00,31,78,137000,1941
"07189100","Buffalo Creek at Tiff City, MO",-94.60411190,36.67090486,60.8,10,2,12,0,-999,-999,2019-05-23,6280,2019-05-23,10.85,9,17,26300,2011
"07194500","Arkansas River near Muskogee, OK",-95.29718670,35.76954320,96472,28,7,32,7,34,6,2019-05-26,617000,2019-05-26,46.39,2,60,700000,1943
"07228500","Canadian River at Bridgeport, OK",-98.31783880,35.54366175,24698,14,6,16,5,17,2,2019-05-26,24900,2019-05-26,17.36,25,70,150000,1948
"07228940","Canadian River near Mustang, OK",-97.72361110,35.32416667,25134,12,2,14,0,16,0,2019-05-22,16000,2019-05-22,13.61,5,11,73500,2007
"07229050","Canadian River at Norman, OK",-97.48503390,35.19451115,25296,94,3,96,2,99,0,2019-05-21,14700,2019-05-21,96.03,5,13,49700,2007
"07235000","Wolf Ck at Lipscomb, TX",-100.27568890,36.23864885,697,9.5,1,11.5,0,16,0,2019-05-24,3810,2019-05-24,10.36,17,61,25400,2007
"07237500","North Canadian River at Woodward, OK",-99.27843830,36.43670336,11883,9,1,11,0,12,0,2019-05-27,856,2019-05-27,9.31,54,80,42000,1946
"07238000","North Canadian River near Seiling, OK",-98.92120570,36.18337277,12555,11,6,13,2,14,0,2019-05-26,2630,2019-05-26,13.12,38,72,33000,1951
"07239300","North Canadian River blw Weavers Ck nr Watonga, OK",-98.42090530,35.81198860,13023,15,6,17,1,18,0,2019-05-26,3720,2019-05-26,17.51,6,34,7220,2007
"07239500","North Canadian River near El Reno, OK",-97.95754980,35.56310656,13317,17,1,19,1,21,0,2019-05-21,10800,2019-05-21,19.35,6,85,23800,2007
"07239700","North Canadian River near Yukon, OK",-97.74254420,35.53949850,13456,14,3,16,2,17,0,2019-05-22,19300,2019-05-21,16.85,2,18,25100,2007
"07241000","North Canadian River blw Lk Overholser nr OKC, OK",-97.66337520,35.47866848,13493,24,2,27,0,29,0,2019-05-22,10300,2019-05-22,25.35,8,65,135000,1923
"07241520","North Canadian River at Britton Rd at OKC, OK",-97.36725800,35.56561470,13688,17,3,21,0,26,0,2019-05-21,20700,2019-05-21,20.81,7,29,38100,1993
"07241550","North Canadian River near Harrah, OK",-97.19391940,35.50034120,13775,14,5,16,3,18,2,2019-05-21,15700,2019-05-21,18.32,8,49,27200,1987
"07242380","Deep Fork at Warwick, OK",-97.00836150,35.68089589,527,21,3,23,3,25,2,2019-05-21,14000,2019-05-21,26.95,11,33,34600,1995
"07243500","Deep Fork near Beggs, OK",-96.06860770,35.67398760,2004,18,6,22,5,27,0,2019-05-26,20300,2019-05-26,26.13,18,79,66800,1943
"07249413","Poteau River near Panama, OK",-94.65300160,35.16565268,1785,29,3,33,2,41,0,2019-05-27,18400,2019-05-27,35.15,17,28,82100,2015
"07250550","AR River at James W. Trimble L&D nr Van Buren, AR",-94.29833330,35.34888889,151000,392.5,2,-999,-999,-999,-999,2019-05-20,142000,2019-05-23,397.44,33,47,401000,1990
"07258000","Arkansas River at Dardanelle, AR",-93.14944440,35.22611110,154000,32,4,36,3,40,1,-999,-999,2019-05-27,42.07,-999,-999,-999,-999
"07260800","Arkansas River near Morrilton, AR",-92.73166670,35.12694444,155000,30,4,34,3,38,1,-999,-999,2019-05-27,39.78,-999,-999,-999,-999
"07263650","Arkansas River at Pine Bluff, AR",-91.99555560,34.29027778,159000,42,2,44,0,45,0,-999,-999,2019-05-27,43.78,-999,-999,-999,-999
"07288700","BIG SUNFLOWER RIVER NR ANGUILLA, MS",-90.77787580,32.97179360,2578.67,45,8,48,6,50,0,-999,-999,2019-05-22,48.21,-999,-999,-999,-999
"07289000","MISSISSIPPI RIVER AT VICKSBURG, MS",-90.90583330,32.31500000,1144500,43,8,46,8,50,1,2019-05-24,1640000,2019-05-21,50.00,22,103,2310000,2011
"07289730","BIG BLACK RIVER NR BENTONIA, MS",-90.36388890,32.60305556,2340,22,2,25,0,29,0,2019-05-20,10800,2019-05-20,24.29,55,78,86000,1983
"07290000","BIG BLACK RIVER NR BOVINA, MS",-90.69694440,32.34777778,2812,28,4,38,0,40,0,2019-05-20,13000,2019-05-20,32.00,77,82,92300,1983
"07299540","Pr Dog Twn Fk Red Rv nr Childress, TX",-100.19400230,34.56922728,7725,10,1,14,0,20,0,2019-05-26,5590,2019-05-26,10.03,43,53,92300,2015
"07299670","Groesbeck Ck at SH 6 nr Quanah, TX",-99.74037190,34.35451979,303,14,2,18,2,22,0,2019-05-25,5100,2019-05-25,19.03,10,56,18000,1983
"07301500","North Fork Red River near Carter, OK",-99.50731280,35.16810838,2652,16,3,17,1,18,0,2019-05-26,10900,2019-05-26,17.84,22,89,53400,1959
"07305000","North Fork Red River near Headrick, OK",-99.10369100,34.63812660,4560,14,7,16,4,19,1,2019-05-27,49200,2019-05-27,21.13,5,84,60000,1935
"07307010","Otter Creek near Snyder, OK",-98.99868760,34.63784918,162,11,5,13,2,15,0,-999,-999,2019-05-25,14.19,-999,-999,-999,-999
"07307028","North Fork Red River near Tipton, OK",-99.20813890,34.50702089,5010,14,5,16,1,18,0,2019-05-27,32700,2019-05-27,17.48,4,34,57200,1986
"07308200","Pease Rv nr Vernon, TX",-99.32333330,34.17958330,3488,15,1,17,0,19,0,2019-05-26,19500,2019-05-26,16.83,12,56,40500,1983
"07308500","Red Rv nr Burkburnett, TX",-98.53172340,34.11009327,20570,9,2,12,0,14,0,2019-05-27,24500,2019-05-27,9.83,32,58,174000,1995
"07311000","East Cache Creek near Walters, OK",-98.28254680,34.36230747,694,21,7,22,6,26,4,2019-05-26,8430,2019-05-26,27.38,29,74,50900,1983
"07311500","Deep Red Creek near Randlett, OK",-98.45311040,34.22092454,604,20,6,23,2,26,0,2019-05-23,9110,2019-05-23,24.19,30,68,72300,1983
"07311800","S Wichita Rv nr Benjamin, TX",-99.80092520,33.64425700,584,12,2,14,2,16,1,2019-05-21,2180,2019-05-21,16.25,35,57,14900,1990
"07311900","Wichita Rv nr Seymour, TX",-99.38869050,33.70036966,1874,13,2,15,2,17,0,2019-05-22,8010,2019-05-22,16.98,13,40,23100,1965
"07312200","Beaver Ck nr Electra, TX",-98.90506660,33.90592785,652,24,6,26,5,28,3,2019-05-23,4420,2019-05-23,30.81,14,57,11700,1961
"07313000","Little Beaver Creek near Duncan, OK",-98.11420680,34.49313567,157,20,1,-999,-999,-999,-999,-999,-999,2019-05-21,23.71,-999,-999,-999,-999
"07314900","Little Wichita Rv abv Henrietta, TX",-98.24004580,33.82676660,1037,17,5,22,0,25,0,2019-05-23,1220,2019-05-23,18.21,42,65,14200,1990
"07315700","Mud Creek near Courtney, OK",-97.56696800,34.00426516,574,20,3,25,0,30,0,2019-05-22,1830,2019-05-22,21.15,49,58,64300,2015
"07324400","Washita River near Foss, OK",-99.16981280,35.53893790,1526,18,2,20,0,22,0,2019-05-26,2000,2019-05-26,19.34,8,58,14000,1957
"07325000","Washita River near Clinton, OK",-98.96702960,35.53088320,1961,18,5,20,3,24,0,2019-05-27,4680,2019-05-27,23.28,28,84,90000,1934
"07325500","Washita River at Carnegie, OK",-98.56395030,35.11728108,3116,25,2,27,2,29,1,-999,-999,2019-05-27,30.37,-999,-999,-999,-999
"07326500","Washita River at Anadarko, OK",-98.24338490,35.08422846,3640,19,4,21,2,23,0,2019-05-27,10600,2019-05-27,22.36,15,63,52800,1995
"07342500","S Sulphur Rv nr Cooper, TX",-95.59495620,33.35649900,527,16,8,20,0,25,0,2019-05-20,3520,2019-05-20,19.55,66,75,47200,1982
"07343200","Sulphur Rv nr Talco, TX",-95.13244280,33.38622330,1365,20,5,26,0,27.5,0,2019-05-20,11000,2019-05-20,24.13,54,61,79800,2001
"07346310","USCOE Caddo Lk nr Mooringsport, LA",-93.91962550,32.70514488,-999,172,10,174.5,0,178,0,-999,-999,2019-05-20,174.10,-999,-999,-999,-999
"07348500","(COE) Red River at Shreveport, LA",-93.74045650,32.51542970,60613.00,30,2,31.5,0,33,0,-999,-999,2019-05-22,30.08,-999,-999,-999,-999
"07348700","Bayou Dorcheat near Springhill, LA",-93.39656000,32.99458130,605.00,11,8,18,0,21,0,2019-05-22,2490,2019-05-22,13.29,54,60,36700,1997
"07349650","(COE) Byu Bodcau Lake nr Shreveport, LA (Landside)",-93.51045210,32.70236807,668.00,172,8,192,0,198,0,-999,-999,2019-05-20,188.93,-999,-999,-999,-999
"07350500","(COE) Red River at Coushatta",-93.35295020,32.01266134,63362.00,31,5,33,0,37,0,-999,-999,2019-05-20,31.81,-999,-999,-999,-999
"07362000","Ouachita River at Camden, AR",-92.81805560,33.59638889,5360,26,8,36,0,40,0,2019-05-24,26300,2019-05-23,30.48,79,88,243000,1945
"07367005","Ouachita River at West Monroe, LA",-92.11972220,32.50027778,15298,40,8,43,8,45,8,2019-05-23,77200,2019-05-23,45.88,3,10,88500,2009
"07369649","Tensas River South of Newlight, LA",-91.48984150,32.08932064,957.00,55,8,57,0,60,0,-999,-999,2019-05-20,55.64,-999,-999,-999,-999
"07372200","Little River near Rochelle, LA",-92.34458330,31.75433630,1899.00,32,1,38,0,42,0,2019-05-20,8170,2019-05-20,32.04,54,60,133000,2016
"07381515","Atchafalaya River at Butte La Rose, LA",-91.68677970,30.28158638,-999,20,8,25,0,28,0,-999,-999,2019-05-24,20.19,-999,-999,-999,-999
"07381600","Lower Atchafalaya River at Morgan City, LA",-91.21193680,29.69281939,-999,6,8,7,8,12,0,2019-05-23,333000,2019-05-21,8.55,5,41,512000,2011
"07386880","Vermilion River at Surrey St. at Lafayette, LA",-91.99289750,30.21742290,-999,10,7,14,0,16,0,2019-05-21,2680,2019-05-20,11.85,36,50,6280,1989
"07387040","Vermilion Bay near Cypremort Point, LA",-91.88039820,29.71326575,-999,4,2,-999,-999,-999,-999,-999,-999,2019-05-21,4.88,-999,-999,-999,-999
"08012150","Mermentau River At Mermentau, LA",-92.59055560,30.19000000,1381.00,4,8,6,0,8,0,2019-05-20,12300,2019-05-20,5.15,28,74,58000,1985
"08013000","Calcasieu River nr Glenmora, LA",-92.67361110,30.99666667,499.00,12,7,16,0,18,0,2019-05-23,4120,2019-05-23,14.13,65,74,59900,1953
"08013500","Calcasieu River near Oberlin, LA",-92.81403680,30.64047570,753.00,13,4,15,0,19,0,2019-05-22,5310,2019-05-22,14.33,72,81,72800,1953
"08014500","Ouiska Chitto Creek Near Oberlin, LA",-92.89319440,30.69875000,510.00,15,3,20,0,23,0,2019-05-22,7230,2019-05-22,17.00,54,79,144000,1953
"08014800","Bundick Creek near DeRidder, LA",-93.23016190,30.81880557,120.00,20,1,21.5,0,22.5,0,2019-05-20,8810,2019-05-20,20.72,9,36,33600,1953
"08015500","Calcasieu River near Kinder, LA",-92.91541670,30.50255556,1700,16,4,20,0,23,0,2019-05-22,16600,2019-05-22,17.65,61,81,182000,1953
"08017300","S Fk Sabine Rv nr Quinlan, TX",-96.25331180,32.89790085,78.7,15,1,18,0,20,0,2019-05-20,1150,2019-05-20,15.36,58,59,23040,1981
"08018500","Sabine Rv nr Mineola, TX",-95.48579010,32.61374667,1357,14,8,18,0,21,0,2019-05-20,6930,2019-05-20,17.20,53,71,76000,1945
